{
  "schemaVersion": 1,
  "postureID": "posture.fixture.1",
  "trainerID": "trainer.fixture.1",
  "branchID": "branch.fixture.1",
  "evidenceCutoff": 10,
  "objective": "balanced",
  "aggression": 0.5,
  "riskTolerance": 0.5,
  "switchPreference": 0.5,
  "itemPreference": 0.5,
  "evidenceIDs": []
}
